{
  "mandate_id": "india-auto-components-001",
  "client": "Aveyroni demo",
  "source_text": "Find founder/family-owned Indian auto-component manufacturers with estimated ₹300–1,500 crore revenue, supplying Tier-1/OEM customers, with export capability, attractive niche manufacturing capabilities, no known institutional PE ownership, and potential for operational/export value creation.",
  "sector": ["auto components"],
  "geography": ["India"],
  "revenue_min_inr_cr": 300,
  "revenue_max_inr_cr": 1500,
  "ownership": ["founder", "family"],
  "exclude_ownership": ["private_equity"],
  "business_model": ["manufacturer", "tier-1 or OEM supplier"],
  "preferences": [
    "exports",
    "OEM relationships",
    "specialized manufacturing"
  ],
  "mandatory_checks": [
    "geography",
    "sector",
    "ownership",
    "size",
    "business model"
  ]
}
